<?xml version="1.0" encoding="UTF-8"?>
<document xmlns="http://www.rbs.fr/schema/change-document/4.0" xmlns:xsi="http://www.w3.org/2001/XMLSchema-instance"
	xsi:schemaLocation="http://www.rbs.fr/schema/change-document/4.0 http://www.rbschange.fr/schema/4.0/document.xsd"
	localized="true" activable="true" editable="true">
	<properties>
		<property name="website" type="Document" document-type="Rbs_Website_Website" required="true" />
		<property name="entries" type="InlineArray" has-correction="true">
			<inline name="MenuEntry" localized="true" editable="true">
				<properties>
					<property name="title" type="String" localized="true" />
					<property name="entryTypeCode" type="String" required="true" />
					<property name="targetDocument" type="Document" />
					<property name="url" type="String" localized="true" />
					<property name="subMenu" type="Document" />
				</properties>
			</inline>
		</property>
		<property name="title" type="String" localized="true" has-correction="true" />
	</properties>
</document>