<?xml version="1.0" encoding="UTF-8"?>
<document xmlns="http://www.rbs.fr/schema/change-document/4.0" xmlns:xsi="http://www.w3.org/2001/XMLSchema-instance"
	xsi:schemaLocation="http://www.rbs.fr/schema/change-document/4.0 http://www.rbschange.fr/schema/4.0/document.xsd"
	editable="true" localized="true">
	<properties>
		<property name="title" type="String" localized="true" />

		<property name="code" type="String">
			<dboptions length="80" />
			<constraint name="unique" />
		</property>
		<property name="country" type="Document" document-type="Rbs_Geo_Country" />
		<property name="addressFilterData" type="JSON" />

		<property name="filterErrorMessage" type="LongString" localized="true" />
	</properties>
</document>