<?xml version="1.0" encoding="UTF-8"?>
<document xmlns="http://www.rbs.fr/schema/change-document/4.0" xmlns:xsi="http://www.w3.org/2001/XMLSchema-instance"
		  xsi:schemaLocation="http://www.rbs.fr/schema/change-document/4.0 http://www.rbschange.fr/schema/4.0/document.xsd"
	editable="true">
	<properties>
		<property name="label" stateless="true" />
		<property name="ownerId" type="DocumentId" />

		<property name="code" type="String" />
		<property name="webStoreId" type="DocumentId" document-type="Rbs_Store_WebStore"/>
		<property name="billingAreaId" type="DocumentId" document-type="Rbs_Price_BillingArea"/>
		<property name="contextData" type="JSON" />

		<property name="linesData" type="JSON" />
		<property name="addressData" type="JSON" />
		<property name="shippingData" type="JSON" />

		<property name="amount" type="Decimal" />
		<property name="amountWithTax" type="Decimal" />
		<property name="currencyCode" type="String">
			<dboptions length="3" />
		</property>

		<property name="closed" type="Boolean" default-value="false"/>

	</properties>
</document>