<?xml version="1.0" encoding="UTF-8"?>
<document xmlns="http://www.rbs.fr/schema/change-document/4.0" xmlns:xsi="http://www.w3.org/2001/XMLSchema-instance"
	xsi:schemaLocation="http://www.rbs.fr/schema/change-document/4.0 http://www.rbschange.fr/schema/4.0/document.xsd"
	editable="true">
	<properties>
		<property name="label" stateless="true" />
		<property name="email" type="String" />
		<property name="ownerId" type="DocumentId" />
		<property name="targetIdentifier" type="String" />
		<property name="contextData" type="JSON" />
		<property name="amount" type="Decimal" />
		<property name="currencyCode" type="String">
			<dboptions length="3" />
		</property>
		<property name="processingStatus" type="String" default-value="initiated">
			<dboptions length="10" />
			<constraint name="enum" values="initiated,processing,success,failed" />
		</property>
		<property name="connector" type="Document" document-type="Rbs_Payment_Connector" />
		<property name="processingIdentifier" type="String" />
		<property name="processingDate" type="DateTime" />
		<property name="processingData" type="JSON" />
	</properties>
</document>