<?xml version="1.0" encoding="UTF-8"?>
<document xmlns="http://www.rbs.fr/schema/change-document/4.0" xmlns:xsi="http://www.w3.org/2001/XMLSchema-instance" 
	xsi:schemaLocation="http://www.rbs.fr/schema/change-document/4.0 http://www.rbschange.fr/schema/4.0/document.xsd" 
	icon="user" has-url="false" editable="true">
	<properties>
		<property name="realm" type="String">
			<dboptions length="128" />
		</property>

		<property name="identifier" type="String">
			<dboptions length="50" />
			<constraint name="maxSize" max="50" />
			<constraint name="unique" />
			<constraint name="matches" pattern="/^[a-z][a-z0-9_\-]{1,49}$/" />
		</property>
	</properties>
</document>