<?xml version="1.0" encoding="UTF-8"?>
<document xmlns="http://www.rbs.fr/schema/change-document/4.0" xmlns:xsi="http://www.w3.org/2001/XMLSchema-instance"
	xsi:schemaLocation="http://www.rbs.fr/schema/change-document/4.0 http://www.rbschange.fr/schema/4.0/document.xsd"
	publishable="true" localized="true" editable="true">
	<properties>
		<property name="title" has-correction="true" />
		<property name="publicationSections" type="DocumentArray" document-type="Rbs_Website_Section" />
		<property name="fields" type="InlineArray" has-correction="true">
			<inline name="FormField" localized="true" editable="true">
				<properties>
					<property name="name" type="String" required="true" />
					<property name="title" type="String" localized="true" />
					<property name="helpText" type="RichText" localized="true" />
					<property name="fieldTypeCode" type="String" required="true" />
					<property name="required" type="Boolean" default-value="false" />
					<property name="parameters" type="JSON" />
				</properties>
			</inline>
		</property>
		<property name="receiverUsers" type="DocumentArray" document-type="Rbs_User_User" />
		<property name="receiverGroups" type="DocumentArray" document-type="Rbs_User_Group" />
		<property name="receiverEmails" type="LongString">
			<constraint name="emails" />
		</property>
		<property name="confirmationMode" type="String" has-correction="true" default-value="message" />
		<property name="confirmationMessage" type="RichText" localized="true" has-correction="true" />
		<property name="confirmationPage" type="Document" document-type="Rbs_Website_StaticPage" has-correction="true" />
		<property name="useCaptcha" type="Boolean" default-value="true" has-correction="true" />
		<property name="sendAcknowledgment" type="Boolean" default-value="false" />
		<property name="saveResponses" type="Boolean" default-value="true" />
	</properties>
</document>